{
  "active_binding_digest": "sha256:8aa52aa5692a4c96fe3e4fdf11fdb2c38757a7708c99148c6520169f09607c18",
  "entries": [
    {
      "activated_by_decision_digest": "sha256:1031fe2d9439d8acf1dd56e0258c24f548a43e381b346f6d4ad99b73372fa132",
      "binding_digest": "sha256:345aa744baf91089d5e12396b161101344aa0bbb5bb0686c8954758797a29f0b",
      "binding_id": "generic-service-binding",
      "path": "framework/generic-sdlc/binding.json"
    },
    {
      "activated_by_decision_digest": "sha256:66c96f5fd3f9edbf5ddcf240fbeaffb6005257236fdbee0308f4a8a47ee511d6",
      "binding_digest": "sha256:fcde7fdeb0efade2cfcf345cde120c8b34bd20e5786688fcbe21c493d5e5ab85",
      "binding_id": "concordloom-self-binding",
      "path": "docs/.concord-transition/binding.json",
      "previous_binding_digest": "sha256:345aa744baf91089d5e12396b161101344aa0bbb5bb0686c8954758797a29f0b"
    },
    {
      "activated_by_decision_digest": "sha256:d2957b599fbc877c7417d2a0ed90c6c3778a57adf177bc888ac9fe3fdc3f9637",
      "binding_digest": "sha256:5797d2fb3552fda89c35ec0c20b10f0c8e65ee0254fa46aad34ae1e862b01bb5",
      "binding_id": "concordloom-self-binding-v2",
      "path": "framework/concordloom/binding.json",
      "previous_binding_digest": "sha256:fcde7fdeb0efade2cfcf345cde120c8b34bd20e5786688fcbe21c493d5e5ab85"
    },
    {
      "activated_by_decision_digest": "sha256:16d28f095a418c6760eb1e2cd9c672e68d8fafcea5caf1a32b13758b3e47423e",
      "binding_digest": "sha256:8aa52aa5692a4c96fe3e4fdf11fdb2c38757a7708c99148c6520169f09607c18",
      "binding_id": "concordloom-self-binding-v3",
      "path": "framework/concordloom/v3/binding.json",
      "previous_binding_digest": "sha256:5797d2fb3552fda89c35ec0c20b10f0c8e65ee0254fa46aad34ae1e862b01bb5"
    }
  ],
  "id": "concordloom-binding-catalog",
  "kind": "concordloom.catalog",
  "schema_version": "0.1"
}
